naam,jaar,beschrijving,afbeelding
Calatrava,1932,"De klassieke dress watch van Patek Philippe, gekenmerkt door eenvoudige elegantie en een tijdloos design.", 
Nautilus,1976,"Een van de meest iconische sportieve horloges ooit gemaakt, ontworpen door Gérald Genta.", 
Aquanaut,1997,"Een sportief horloge met een moderne, jeugdige uitstraling en waterbestendigheid tot 120 meter.", 
Complications,1989,"Een reeks horloges met complicaties zoals een eeuwigdurende kalender, een chronograaf of een tourbillon.", 
Grand Complications,1992,"De meest complexe en hoogwaardige horloges van Patek Philippe, met functies zoals een repetitie van de minuten, een eeuwigdurende kalender en een chronograaf.", 
Golden Ellipse,1968,"Een van de meest herkenbare horloges van Patek Philippe, met een ovale kast en een tijdloos ontwerp.", 
Gondolo,1993,"Een horlogecollectie geïnspireerd op de Art Deco-stijl, met rechthoekige kasten en een verfijnde esthetiek.", 
Twenty-4,1999,"Een dameshorlogecollectie met een elegante, moderne stijl en verfijnde details.", 
